{
  "spec_version": "0.2-draft",
  "receipt_id": "urn:one-receipt:r:4ab54810-dbb0-4a4c-b56e-205584185604",
  "transaction_id": "urn:one-receipt:t:ea04c50a-3ba3-448e-92da-46e672516c39",
  "event_id": "urn:one-receipt:e:5ba25e1d-90c3-4297-bdea-9caed2f59d8b",
  "parent_receipt_ids": [],
  "root_receipt_id": "urn:one-receipt:r:4ab54810-dbb0-4a4c-b56e-205584185604",
  "transaction_type": "inference",
  "sequence": 0,
  "boundary": "request-response",
  "started_at": "2026-09-29T16:20:52Z",
  "ended_at": "2026-09-29T16:20:52Z",
  "issued_at": "2026-09-29T16:20:52Z",
  "clock_source": "issuer",
  "issuer": {
    "id": "did:web:cafe.aigovops-foundation.example",
    "key_id": "did:web:cafe.aigovops-foundation.example#receipt-2026-09",
    "role": "operator"
  },
  "assurance_level": "OR-1",
  "privacy_profile": {
    "profile": "content-free",
    "commitment_scheme": "salted-sha256",
    "linkability_scope": "transaction",
    "metadata_minimization": true
  },
  "predicate_manifest": [
    {
      "type": "contestability",
      "version": "1.0",
      "critical": true
    },
    {
      "type": "policy",
      "version": "1.0",
      "critical": true
    },
    {
      "type": "runtime",
      "version": "1.0",
      "critical": true
    },
    {
      "type": "transaction",
      "version": "1.0",
      "critical": true
    }
  ],
  "predicates": {
    "transaction": {
      "interface": "api"
    },
    "policy": {
      "policy_id": "demo",
      "version": "1",
      "decision": "allow",
      "enforcement_point": "pre-action"
    },
    "runtime": {
      "content_included": false
    },
    "contestability": {
      "notice": {
        "given": true
      },
      "explanation": {
        "available": false
      },
      "challenge": {
        "available": true
      },
      "human_review": {
        "available": false
      }
    }
  },
  "limitations": [
    "Integrity verification proves that the issuer signed these claims; it does not prove truth, fairness, safety, legality, accuracy, or absence of harm.",
    "Commitments are content-free; a verifier cannot recover prompts, outputs, weights or personal data from this receipt.",
    "Assurance above OR-2 depends on an independent log and witnesses; the verified level is what the verifier could substantiate, not what the issuer claimed."
  ],
  "signature": {
    "algorithm": "Ed25519",
    "canonicalization": "JCS",
    "key_id": "did:web:cafe.aigovops-foundation.example#receipt-2026-09",
    "value": "agS4kp3a7zeQlad0pIoxUkuXI5zRsVbslXqUSc-hlEM5jbazCeI4JEpYtcXZYKIRyI2x5tvnzhy9I00IWQCbBg"
  }
}
